{
  "$schema": "http://json-schema.org/draft-07/schema#",
  "type": "object",
  "title": "ranges",
  "required": [
    "last_generated",
    "proto_name",
    "name",
    "code",
    "min_max_values"
  ],
  "additionalProperties": false,
  "properties": {
    "last_generated": {
      "type": "string"
    },
    "proto_name": {
      "type": "string",
      "enum": ["RANGES"]
    },
    "name": {
      "type": "string",
      "enum": ["ranges"]
    },
    "code": {
      "type": "string",
      "enum": ["ra"]
    },
    "min_max_values": {
      "$ref": "min_max_values.json"
    }
  }
}
